ID,Category,Name,Method,MethodArgument,RegistryPath,RegistryItem,ClassName,Namespace,Property,DefaultValue,RecommendedValue,Operator,Severity
9.1.2,"Windows Firewall","Inbound Connections (Domain Profile, Policy)",Registry,,HKLM:\SOFTWARE\Policies\Microsoft\WindowsFirewall\DomainProfile,DefaultInboundAction,,,,1,1,=,Medium
9.1.3,"Windows Firewall","Outbound Connections (Domain Profile, Policy)",Registry,,HKLM:\SOFTWARE\Policies\Microsoft\WindowsFirewall\DomainProfile,DefaultOutboundAction,,,,0,0,=,Medium
9.1.4,"Windows Firewall","Display a notification (Domain Profile, Policy)",Registry,,HKLM:\SOFTWARE\Policies\Microsoft\WindowsFirewall\DomainProfile,DisableNotifications,,,,0,1,=,Low
9.1.5,"Windows Firewall","Name of log file (Domain Profile, Policy)",Registry,,HKLM:\SOFTWARE\Policies\Microsoft\WindowsFirewall\DomainProfile\Logging,LogFilePath,,,,%SystemRoot%\System32\logfiles\firewall\pfirewall.log,%SystemRoot%\System32\logfiles\firewall\domainfw.log,=,Low
9.1.6,"Windows Firewall","Log size limit (Domain Profile, Policy)",Registry,,HKLM:\SOFTWARE\Policies\Microsoft\WindowsFirewall\DomainProfile\Logging,LogFileSize,,,,4096,16384,>=,Medium
9.1.7,"Windows Firewall","Log dropped packets (Domain Profile, Policy)",Registry,,HKLM:\SOFTWARE\Policies\Microsoft\WindowsFirewall\DomainProfile\Logging,LogDroppedPackets,,,,0,1,=,Medium
9.1.8,"Windows Firewall","Log successful connections (Domain Profile, Policy)",Registry,,HKLM:\SOFTWARE\Policies\Microsoft\WindowsFirewall\DomainProfile\Logging,LogSuccessfulConnections,,,,0,1,=,Low
9.2.1,"Windows Firewall","EnableFirewall (Private Profile, Policy)",Registry,,HKLM:\SOFTWARE\Policies\Microsoft\WindowsFirewall\PrivateProfile,EnableFirewall,,,,0,1,=,Medium
9.2.2,"Windows Firewall","Inbound Connections (Private Profile, Policy)",Registry,,HKLM:\SOFTWARE\Policies\Microsoft\WindowsFirewall\PrivateProfile,DefaultInboundAction,,,,1,1,=,Medium
9.2.3,"Windows Firewall","Outbound Connections (Private Profile, Policy)",Registry,,HKLM:\SOFTWARE\Policies\Microsoft\WindowsFirewall\PrivateProfile,DefaultOutboundAction,,,,0,0,=,Medium
9.2.4,"Windows Firewall","Display a notification (Private Profile, Policy)",Registry,,HKLM:\SOFTWARE\Policies\Microsoft\WindowsFirewall\PrivateProfile,DisableNotifications,,,,0,1,=,Low
9.2.5,"Windows Firewall","Name of log file (Private Profile, Policy)",Registry,,HKLM:\SOFTWARE\Policies\Microsoft\WindowsFirewall\PrivateProfile\Logging,LogFilePath,,,,%SystemRoot%\System32\logfiles\firewall\pfirewall.log,%SystemRoot%\System32\logfiles\firewall\privatefw.log,=,Low
9.2.6,"Windows Firewall","Log size limit (Private Profile, Policy)",Registry,,HKLM:\SOFTWARE\Policies\Microsoft\WindowsFirewall\PrivateProfile\Logging,LogFileSize,,,,4096,16384,>=,Medium
9.2.7,"Windows Firewall","Log dropped packets (Private Profile, Policy)",Registry,,HKLM:\SOFTWARE\Policies\Microsoft\WindowsFirewall\PrivateProfile\Logging,LogDroppedPackets,,,,0,1,=,Medium
9.2.8,"Windows Firewall","Log successful connections (Private Profile, Policy)",Registry,,HKLM:\SOFTWARE\Policies\Microsoft\WindowsFirewall\PrivateProfile\Logging,LogSuccessfulConnections,,,,0,1,=,Low
9.3.1,"Windows Firewall","EnableFirewall (Public Profile, Policy)",Registry,,HKLM:\SOFTWARE\Policies\Microsoft\WindowsFirewall\PublicProfile,EnableFirewall,,,,0,1,=,Medium
9.3.2,"Windows Firewall","Inbound Connections (Public Profile, Policy)",Registry,,HKLM:\SOFTWARE\Policies\Microsoft\WindowsFirewall\PublicProfile,DefaultInboundAction,,,,1,1,=,Medium
9.3.3,"Windows Firewall","Outbound Connections (Public Profile, Policy)",Registry,,HKLM:\SOFTWARE\Policies\Microsoft\WindowsFirewall\PublicProfile,DefaultOutboundAction,,,,0,0,=,Medium
9.3.4,"Windows Firewall","Display a notification (Public Profile, Policy)",Registry,,HKLM:\SOFTWARE\Policies\Microsoft\WindowsFirewall\PublicProfile,DisableNotifications,,,,0,1,=,Low
9.3.5,"Windows Firewall","Apply local firewall rules (Public Profile, Policy)",Registry,,HKLM:\SOFTWARE\Policies\Microsoft\WindowsFirewall\PublicProfile,AllowLocalPolicyMerge,,,,0,0,=,Low
9.3.6,"Windows Firewall","Apply local connection security rules (Public Profile, Policy)",Registry,,HKLM:\SOFTWARE\Policies\Microsoft\WindowsFirewall\PublicProfile,AllowLocalIPsecPolicyMerge,,,,0,0,=,Low
9.3.7,"Windows Firewall","Name of log file (Public Profile, Policy)",Registry,,HKLM:\SOFTWARE\Policies\Microsoft\WindowsFirewall\PublicProfile\Logging,LogFilePath,,,,%SystemRoot%\System32\logfiles\firewall\pfirewall.log,%SystemRoot%\System32\logfiles\firewall\publicfw.log,=,Low
9.3.8,"Windows Firewall","Log size limit (Public Profile, Policy)",Registry,,HKLM:\SOFTWARE\Policies\Microsoft\WindowsFirewall\PublicProfile\Logging,LogFileSize,,,,4096,16384,>=,Medium
9.3.9,"Windows Firewall","Log dropped packets (Public Profile, Policy)",Registry,,HKLM:\SOFTWARE\Policies\Microsoft\WindowsFirewall\PublicProfile\Logging,LogDroppedPackets,,,,0,1,=,Medium
9.3.10,"Windows Firewall","Log successful connections (Public Profile, Policy)",Registry,,HKLM:\SOFTWARE\Policies\Microsoft\WindowsFirewall\PublicProfile\Logging,LogSuccessfulConnections,,,,0,1,=,Low
17.1.1,"Advanced Audit Policy Configuration","Credential Validation",auditpol,{0CCE923F-69AE-11D9-BED3-505054503030},,,,,,"No Auditing","Success and Failure",=,Low
17.1.2,"Advanced Audit Policy Configuration","Kerberos Authentication Service",auditpol,{0CCE9242-69AE-11D9-BED3-505054503030},,,,,,Success,"Success and Failure",=,Low
17.1.3,"Advanced Audit Policy Configuration","Kerberos Service Ticket Operations",auditpol,{0CCE9240-69AE-11D9-BED3-505054503030},,,,,,Success,"Success and Failure",=,Low
17.2.1,"Advanced Audit Policy Configuration","Application Group Management",auditpol,{0CCE9239-69AE-11D9-BED3-505054503030},,,,,,"No Auditing","Success and Failure",=,Low
17.2.2,"Advanced Audit Policy Configuration","Computer Account Management",auditpol,{0CCE9236-69AE-11D9-BED3-505054503030},,,,,,Success,Success,contains,Low
17.2.3,"Advanced Audit Policy Configuration","Distribution Group Management",auditpol,{0CCE9238-69AE-11D9-BED3-505054503030},,,,,,,Success,contains,Low
17.2.4,"Advanced Audit Policy Configuration","Other Account Management Events",auditpol,{0CCE923A-69AE-11D9-BED3-505054503030},,,,,,,Success,contains,Low
17.2.5,"Advanced Audit Policy Configuration","Security Group Management",auditpol,{0CCE9237-69AE-11D9-BED3-505054503030},,,,,,Success,Success,contains,Low
17.2.6,"Advanced Audit Policy Configuration","User Account Management",auditpol,{0CCE9235-69AE-11D9-BED3-505054503030},,,,,,Success,"Success and Failure",=,Low
17.3.1,"Advanced Audit Policy Configuration","Process Creation",auditpol,{0CCE922B-69AE-11D9-BED3-505054503030},,,,,,"No Auditing",Success,contains,Low
17.4.1,"Advanced Audit Policy Configuration","Directory Service Access",auditpol,{0CCE923B-69AE-11D9-BED3-505054503030},,,,,,Success,Failure,contains,Low
17.4.2,"Advanced Audit Policy Configuration","Directory Service Changes",auditpol,{0CCE923C-69AE-11D9-BED3-505054503030},,,,,,,Success,contains,Low
17.5.1,"Advanced Audit Policy Configuration","Account Lockout",auditpol,{0CCE9217-69AE-11D9-BED3-505054503030},,,,,,Success,Failure,contains,Low
17.5.2,"Advanced Audit Policy Configuration",Logoff,auditpol,{0CCE9216-69AE-11D9-BED3-505054503030},,,,,,Success,Success,contains,Low
17.5.3,"Advanced Audit Policy Configuration",Logon,auditpol,{0CCE9215-69AE-11D9-BED3-505054503030},,,,,,"Success and Failure","Success and Failure",=,Low
17.5.4,"Advanced Audit Policy Configuration","Other Logon/Logoff Events",auditpol,{0CCE921C-69AE-11D9-BED3-505054503030},,,,,,"No Auditing","Success and Failure",=,Low
17.5.5,"Advanced Audit Policy Configuration","Special Logon",auditpol,{0CCE921B-69AE-11D9-BED3-505054503030},,,,,,Success,Success,contains,Low
17.6.1,"Advanced Audit Policy Configuration","Detailed File Share",auditpol,{0CCE9244-69AE-11D9-BED3-505054503030},,,,,,"No Auditing",Failure,contains,Low
17.6.2,"Advanced Audit Policy Configuration","File Share",auditpol,{0CCE9224-69AE-11D9-BED3-505054503030},,,,,,"No Auditing","Success and Failure",=,Low
17.6.3,"Advanced Audit Policy Configuration","Other Object Access Events",auditpol,{0CCE9227-69AE-11D9-BED3-505054503030},,,,,,"No Auditing","Success and Failure",=,Low
17.6.4,"Advanced Audit Policy Configuration","Removable Storage",auditpol,{0CCE9245-69AE-11D9-BED3-505054503030},,,,,,"No Auditing","Success and Failure",=,Low
17.7.1,"Advanced Audit Policy Configuration","Audit Policy Change",auditpol,{0CCE922F-69AE-11D9-BED3-505054503030},,,,,,Success,Success,contains,Low
17.7.2,"Advanced Audit Policy Configuration","Authentication Policy Change",auditpol,{0CCE9230-69AE-11D9-BED3-505054503030},,,,,,Success,Success,contains,Low
17.7.3,"Advanced Audit Policy Configuration","Authorization Policy Change",auditpol,{0CCE9231-69AE-11D9-BED3-505054503030},,,,,,"No Auditing",Success,contains,Low
17.7.4,"Advanced Audit Policy Configuration","MPSSVC Rule-Level Policy Change",auditpol,{0CCE9232-69AE-11D9-BED3-505054503030},,,,,,"No Auditing","Success and Failure",=,Low
17.7.5,"Advanced Audit Policy Configuration","Other Policy Change Events",auditpol,{0CCE9234-69AE-11D9-BED3-505054503030},,,,,,"No Auditing",Failure,contains,Low
17.8.1,"Advanced Audit Policy Configuration","Sensitive Privilege Use",auditpol,{0CCE9228-69AE-11D9-BED3-505054503030},,,,,,"No Auditing","Success and Failure",=,Low
17.9.1,"Advanced Audit Policy Configuration","IPsec Driver",auditpol,{0CCE9213-69AE-11D9-BED3-505054503030},,,,,,"No Auditing","Success and Failure",=,Low
17.9.2,"Advanced Audit Policy Configuration","Other System Events",auditpol,{0CCE9214-69AE-11D9-BED3-505054503030},,,,,,"Success and Failure","Success and Failure",=,Low
17.9.3,"Advanced Audit Policy Configuration","Security State Change",auditpol,{0CCE9210-69AE-11D9-BED3-505054503030},,,,,,Success,Success,contains,Low
17.9.4,"Advanced Audit Policy Configuration","Security System Extension",auditpol,{0CCE9211-69AE-11D9-BED3-505054503030},,,,,,"No Auditing",Success,contains,Low
17.9.5,"Advanced Audit Policy Configuration","System Integrity",auditpol,{0CCE9212-69AE-11D9-BED3-505054503030},,,,,,"Success and Failure","Success and Failure",=,Low
18.1.1.1,"Administrative Templates: Control Panel","Personalization: Prevent enabling lock screen camera",Registry,,HKLM:\Software\Policies\Microsoft\Windows\Personalization,NoLockScreenCamera,,,,0,1,=,Low
18.1.1.2,"Administrative Templates: Control Panel","Personalization: Prevent enabling lock screen slide show",Registry,,HKLM:\Software\Policies\Microsoft\Windows\Personalization,NoLockScreenSlideshow,,,,0,1,=,Low
18.2.1,"Administrative Templates: LAPS","LAPS AdmPwd GPO Extension / CSE (Member)",Registry,,"HKLM:\SOFTWARE\Microsoft\Windows NT\CurrentVersion\Winlogon\GPExtensions\{D76B9641-3288-4f75-942D-087DE603E3EA}",DllName,,,,,"C:\Program Files\LAPS\CSE\AdmPwd.dll",=,Medium
18.2.2,"Administrative Templates: LAPS","Do not allow password expiration time longer than required by policy (Member)",Registry,,"HKLM:\SOFTWARE\Policies\Microsoft Services\AdmPwd",PwdExpirationProtectionEnabled,,,,0,1,=,Medium
18.2.3,"Administrative Templates: LAPS","Enable local admin password management (Member)",Registry,,"HKLM:\Software\Policies\Microsoft Services\AdmPwd",AdmPwdEnabled,,,,0,1,=,Medium
18.2.4,"Administrative Templates: LAPS","Password Settings: Password Complexity (Member)",Registry,,"HKLM:\SOFTWARE\Policies\Microsoft Services\AdmPwd",PasswordComplexity,,,,4,4,=,Medium
18.2.5,"Administrative Templates: LAPS","Password Settings: Password Length (Member)",Registry,,"HKLM:\SOFTWARE\Policies\Microsoft Services\AdmPwd",PasswordLength,,,,14,15,>=,Medium
18.2.6,"Administrative Templates: LAPS","Password Settings: Password Age (Days) (Member)",Registry,,"HKLM:\SOFTWARE\Policies\Microsoft Services\AdmPwd",PasswordAgeDays,,,,30,30,<=,Medium
18.3.1,"MS Security Guide","Apply UAC restrictions to local accounts on network logons (Member)",Registry,,HKLM:\SOFTWARE\Microsoft\Windows\CurrentVersion\Policies\System,LocalAccountTokenFilterPolicy,,,,0,0,=,Medium
18.3.2,"MS Security Guide","Configure SMB v1 client driver",Registry,,HKLM:\SYSTEM\CurrentControlSet\Services\MrxSmb10,Start,,,,1,4,=,Medium
18.3.3,"MS Security Guide","Configure SMB v1 server",Registry,,HKLM:\SYSTEM\CurrentControlSet\Services\LanmanServer\Parameters,SMB1,,,,1,0,=,Medium
18.3.4,"MS Security Guide","Enable Structured Exception Handling Overwrite Protection (SEHOP)",Registry,,"HKLM:\SYSTEM\CurrentControlSet\Control\Session Manager\kernel",DisableExceptionChainValidation,,,,0,0,=,Medium
18.3.5,"MS Security Guide","Extended Protection for LDAP Authentication (DC)",Registry,,HKLM:\SYSTEM\CurrentControlSet\Services\NTDS\Parameters,LdapEnforceChannelBinding,,,,1,2,=,Medium
18.3.6,"MS Security Guide","NetBT NodeType configuration",Registry,,HKLM:\SYSTEM\CurrentControlSet\Services\NetBT\Parameters,NodeType,,,,0,2,=,Medium
18.3.7,"MS Security Guide","WDigest Authentication",Registry,,HKLM:\SYSTEM\CurrentControlSet\Control\SecurityProviders\WDigest,UseLogonCredential,,,,0,0,=,High
18.4.1,"MSS (Legacy)","MSS: (AutoAdminLogon) Enable Automatic Logon (not recommended)",Registry,,"HKLM:\SOFTWARE\Microsoft\Windows NT\CurrentVersion\Winlogon",AutoAdminLogon,,,,0,0,=,Medium
18.4.2,"MSS (Legacy)","MSS: (DisableIPSourceRouting IPv6) IP source routing protection level (protects against packet spoofing)",Registry,,HKLM:\System\CurrentControlSet\Services\Tcpip6\Parameters,DisableIPSourceRouting,,,,0,2,=,Medium
18.4.3,"MSS (Legacy)","MSS: (DisableIPSourceRouting) IP source routing protection level (protects against packet spoofing)",Registry,,HKLM:\System\CurrentControlSet\Services\Tcpip\Parameters,DisableIPSourceRouting,,,,1,2,=,Medium
18.4.4,"MSS (Legacy)","MSS: (EnableICMPRedirect) Allow ICMP redirects to override OSPF generated routes",Registry,,HKLM:\System\CurrentControlSet\Services\Tcpip\Parameters,EnableICMPRedirect,,,,1,0,=,Medium
18.4.5,"MSS (Legacy)","MSS: (KeepAliveTime) How often keep-alive packets are sent in milliseconds",Registry,,HKLM:\SYSTEM\CurrentControlSet\Services\Tcpip\Parameters,KeepAliveTime,,,,7200000,300000,<=,Medium
18.4.6,"MSS (Legacy)","MSS: (NoNameReleaseOnDemand) Allow the computer to ignore NetBIOS name release requests except from WINS servers",Registry,,HKLM:\System\CurrentControlSet\Services\Netbt\Parameters,NoNameReleaseOnDemand,,,,0,1,=,Medium
18.4.7,"MSS (Legacy)","MSS: (PerformRouterDiscovery) Allow IRDP to detect and configure Default Gateway addresses (could lead to DoS)",Registry,,HKLM:\SYSTEM\CurrentControlSet\Services\Tcpip\Parameters,PerformRouterDiscovery,,,,0,0,=,Medium
18.4.8,"MSS (Legacy)","MSS: (SafeDllSearchMode) Enable Safe DLL search mode (recommended)",Registry,,"HKLM:\SYSTEM\CurrentControlSet\Control\Session Manager",SafeDLLSearchMode,,,,0,1,=,Medium
18.4.9,"MSS (Legacy)","MSS: (ScreenSaverGracePeriod) The time in seconds before the screen saver grace period expires (0 recommended)",Registry,,"HKLM:\SOFTWARE\Microsoft\Windows NT\CurrentVersion\Winlogon",ScreenSaverGracePeriod,,,,5,5,<=,Medium
18.4.10,"MSS (Legacy)","MSS: (TcpMaxDataRetransmissions IPv6) How many times unacknowledged data is retransmitted",Registry,,HKLM:\System\CurrentControlSet\Services\Tcpip6\Parameters,TcpMaxDataRetransmissions,,,,5,3,<=,Medium
18.4.11,"MSS (Legacy)","MSS: (TcpMaxDataRetransmissions) How many times unacknowledged data is retransmitted",Registry,,HKLM:\System\CurrentControlSet\Services\Tcpip\Parameters,TcpMaxDataRetransmissions,,,,5,3,<=,Medium
18.4.12,"MSS (Legacy)","MSS: (WarningLevel) Percentage threshold for the security event log at which the system will generate a warning",Registry,,HKLM:\SYSTEM\CurrentControlSet\Services\Eventlog\Security,WarningLevel,,,,0,90,<=,Medium
18.5.4.1,"Administrative Templates: Network","DNS Client: Turn off multicast name resolution (LLMNR)",Registry,,"HKLM:\Software\Policies\Microsoft\Windows NT\DNSClient",EnableMulticast,,,,1,0,=,Medium
18.5.9.1.1,"Administrative Templates: Network","Link-Layer Topology Discovery: Turn on Mapper I/O (LLTDIO) driver (AllowLLTDIOOndomain)",Registry,,HKLM:\Software\Policies\Microsoft\Windows\LLTD,AllowLLTDIOOndomain,,,,0,0,=,Medium
18.5.9.1.2,"Administrative Templates: Network","Link-Layer Topology Discovery: Turn on Mapper I/O (LLTDIO) driver (AllowLLTDIOOnPublicNet)",Registry,,HKLM:\Software\Policies\Microsoft\Windows\LLTD,AllowLLTDIOOnPublicNet,,,,0,0,=,Medium
18.5.9.1.3,"Administrative Templates: Network","Link-Layer Topology Discovery: Turn on Mapper I/O (LLTDIO) driver (EnableLLTDIO)",Registry,,HKLM:\Software\Policies\Microsoft\Windows\LLTD,EnableLLTDIO,,,,0,0,=,Medium
18.5.9.1.4,"Administrative Templates: Network","Link-Layer Topology Discovery: Turn on Mapper I/O (LLTDIO) driver (ProhibitLLTDIOOnPrivateNet)",Registry,,HKLM:\Software\Policies\Microsoft\Windows\LLTD,ProhibitLLTDIOOnPrivateNet,,,,0,0,=,Medium
18.5.9.2.1,"Administrative Templates: Network","Turn on Responder (RSPNDR) driver (AllowRspndrOnDomain)",Registry,,HKLM:\SOFTWARE\Policies\Microsoft\Windows\LLTD,AllowRspndrOnDomain,,,,0,0,=,Medium
18.5.9.2.2,"Administrative Templates: Network","Turn on Responder (RSPNDR) driver (AllowRspndrOnPublicNet)",Registry,,HKLM:\Software\Policies\Microsoft\Windows\LLTD,AllowRspndrOnPublicNet,,,,0,0,=,Medium
18.5.9.2.3,"Administrative Templates: Network","Turn on Responder (RSPNDR) driver (EnableRspndr)",Registry,,HKLM:\Software\Policies\Microsoft\Windows\LLTD,EnableRspndr,,,,0,0,=,Medium
18.5.9.2.4,"Administrative Templates: Network","Turn on Responder (RSPNDR) driver (ProhibitRspndrOnPrivateNet)",Registry,,HKLM:\Software\Policies\Microsoft\Windows\LLTD,ProhibitRspndrOnPrivateNet,,,,0,0,=,Medium
18.5.10.1,"Administrative Templates: Network","Turn off Microsoft Peer-to-Peer Networking Services",Registry,,HKLM:\Software\policies\Microsoft\Peernet,Disabled,,,,0,1,=,Medium
18.5.11.2,"Administrative Templates: Network","Network Connections: Prohibit installation and configuration of Network Bridge on your DNS domain network",Registry,,"HKLM:\Software\Policies\Microsoft\Windows\Network Connections",NC_AllowNetBridge_NLA,,,,0,0,=,Medium
18.5.11.3,"Administrative Templates: Network","Network Connections: Require domain users to elevate when setting a network's location",Registry,,"HKLM:\Software\Policies\Microsoft\Windows\Network Connections",NC_StdDomainUserSetLocation,,,,0,1,=,Medium
18.5.14.1.1,"Administrative Templates: Network","Network Provider: Hardened UNC Paths (NETLOGON)",Registry,,HKLM:\Software\Policies\Microsoft\Windows\NetworkProvider\HardenedPaths,\\*\NETLOGON,,,,,"RequireMutualAuthentication=1, RequireIntegrity=1",=,Medium
18.5.14.1.2,"Administrative Templates: Network","Network Provider: Hardened UNC Paths (SYSVOL)",Registry,,HKLM:\Software\Policies\Microsoft\Windows\NetworkProvider\HardenedPaths,\\*\SYSVOL,,,,,"RequireMutualAuthentication=1, RequireIntegrity=1",=,Medium
18.5.19.2.1,"Administrative Templates: Network","Disable IPv6",Registry,,HKLM:\SYSTEM\CurrentControlSet\Services\TCPIP6\Parameters,DisabledComponents,,,,0,255,=,Medium
18.5.20.1.1,"Administrative Templates: Network","Windows Connect Now: Configuration of wireless settings using Windows Connect Now (EnableRegistrars)",Registry,,HKLM:\SOFTWARE\Policies\Microsoft\Windows\WCN\Registrars,EnableRegistrars,,,,1,0,=,Medium
18.5.20.1.2,"Administrative Templates: Network","Windows Connect Now: Configuration of wireless settings using Windows Connect Now (DisableUPnPRegistrar)",Registry,,HKLM:\SOFTWARE\Policies\Microsoft\Windows\WCN\Registrars,DisableUPnPRegistrar,,,,1,0,=,Medium
18.5.20.1.3,"Administrative Templates: Network","Windows Connect Now: Configuration of wireless settings using Windows Connect Now (DisableInBand802DOT11Registrar)",Registry,,HKLM:\SOFTWARE\Policies\Microsoft\Windows\WCN\Registrars,DisableInBand802DOT11Registrar,,,,1,0,=,Medium
18.5.20.1.4,"Administrative Templates: Network","Windows Connect Now: Configuration of wireless settings using Windows Connect Now (DisableFlashConfigRegistrar)",Registry,,HKLM:\SOFTWARE\Policies\Microsoft\Windows\WCN\Registrars,DisableFlashConfigRegistrar,,,,1,0,=,Medium
18.5.20.1.5,"Administrative Templates: Network","Windows Connect Now: Configuration of wireless settings using Windows Connect Now (DisableWPDRegistrar)",Registry,,HKLM:\SOFTWARE\Policies\Microsoft\Windows\WCN\Registrars,DisableWPDRegistrar,,,,1,0,=,Medium
18.5.20.2,"Administrative Templates: Network","Windows Connect Now: Prohibit access of the Windows Connect Now wizards",Registry,,HKLM:\SOFTWARE\Policies\Microsoft\Windows\WCN\UI,DisableWcnUi,,,,0,1,=,Medium
18.5.21.1,"Administrative Templates: Network","Windows Connection Manager: Minimize the number of simultaneous connections to the Internet or a Windows Domain",Registry,,HKLM:\SOFTWARE\Policies\Microsoft\Windows\WcmSvc\GroupPolicy,fMinimizeConnections,,,,1,3,=,Medium
18.5.21.2,"Administrative Templates: Network","Windows Connection Manager: Prohibit connection to non-domain networks when connected to domain authenticated network",Registry,,HKLM:\Software\Policies\Microsoft\Windows\WcmSvc\GroupPolicy,fBlockNonDomain,,,,0,1,=,Medium
18.7.1.1,"Administrative Templates: Start Menu and Taskbar","Notifications: Turn off notifications network usage",Registry,,HKLM:\SOFTWARE\Policies\Microsoft\Windows\CurrentVersion\PushNotifications,NoCloudApplicationNotification,,,,0,1,=,Medium
18.8.3.1,"Administrative Templates: System","Audit Process Creation: Include command line in process creation events",Registry,,HKLM:\SOFTWARE\Microsoft\Windows\CurrentVersion\Policies\System\Audit,ProcessCreationIncludeCmdLine_Enabled,,,,0,0,=,Medium
18.8.4.1,"Administrative Templates: System","Credentials Delegation: Encryption Oracle Remediation",Registry,,HKLM:\SOFTWARE\Microsoft\Windows\CurrentVersion\Policies\System\CredSSP\Parameters,AllowEncryptionOracle,,,,0,0,=,Medium
18.8.4.2,"Administrative Templates: System","Credentials Delegation: Remote host allows delegation of non-exportable credentials",Registry,,HKLM:\Software\Policies\Microsoft\Windows\CredentialsDelegation,AllowProtectedCreds,,,,0,1,=,Medium
18.8.14.1,"Administrative Templates: System","Early Launch Antimalware: Boot-Start Driver Initialization Policy",Registry,,HKLM:\System\CurrentControlSet\Policies\EarlyLaunch,DriverLoadPolicy,,,,0,3,=,Medium
18.8.21.1,"Administrative Templates: System","Group Policy: Do not apply during periodic background processing",Registry,,"HKLM:\Software\Policies\Microsoft\Windows\Group Policy\{35378EAC-683F-11D2-A89A-00C04FBBCFA2}",NoGPOListChanges,,,,0,0,=,Medium
18.8.21.2,"Administrative Templates: System","Group Policy: Process even if the Group Policy objects have not changed",Registry,,"HKLM:\Software\Policies\Microsoft\Windows\Group Policy\{35378EAC-683F-11D2-A89A-00C04FBBCFA2}",NoBackgroundPolicy,,,,1,0,=,Medium
18.8.21.3,"Administrative Templates: System","Group Policy: Turn off background refresh of Group Policy",Registry,,HKLM:\SOFTWARE\Microsoft\Windows\CurrentVersion\Policies\System,DisableBkGndGroupPolicy,,,,0,0,=,Medium
18.8.22.1.1,"Administrative Templates: System","Internet Communication Management: Internet Communication settings: Turn off downloading of print drivers over HTTP",Registry,,"HKLM:\Software\Policies\Microsoft\Windows NT\Printers",DisableWebPnPDownload,,,,0,1,=,Medium
18.8.22.1.2,"Administrative Templates: System","Internet Communication Management: Internet Communication settings: Turn off handwriting personalization data sharing",Registry,,HKLM:\SOFTWARE\Policies\Microsoft\Windows\TabletPC,PreventHandwritingDataSharing,,,,0,1,=,Medium
18.8.22.1.3,"Administrative Templates: System","Internet Communication Management: Internet Communication settings: Turn off handwriting recognition error reporting",Registry,,HKLM:\SOFTWARE\Policies\Microsoft\Windows\HandwritingErrorReports,PreventHandwritingErrorReports,,,,0,1,=,Medium
18.8.22.1.4,"Administrative Templates: System","Internet Communication Management: Internet Communication settings: Turn off Internet Connection Wizard if URL connection is referring to Microsoft.com",Registry,,"HKLM:\SOFTWARE\Policies\Microsoft\Windows\Internet Connection Wizard",ExitOnMSICW,,,,0,1,=,Medium
18.8.22.1.5,"Administrative Templates: System","Internet Communication Management: Internet Communication settings: Turn off Internet download for Web publishing and online ordering wizards",Registry,,HKLM:\Software\Microsoft\Windows\CurrentVersion\Policies\Explorer,NoWebServices,,,,0,1,=,Medium
18.8.22.1.6,"Administrative Templates: System","Internet Communication Management: Internet Communication settings: Turn off printing over HTTP",Registry,,"HKLM:\SOFTWARE\Policies\Microsoft\Windows NT\Printers",DisableHTTPPrinting,,,,0,1,=,Medium
18.8.22.1.7,"Administrative Templates: System","Internet Communication Management: Internet Communication settings: Turn off Registration if URL connection is referring to Microsoft.com",Registry,,"HKLM:\SOFTWARE\Policies\Microsoft\Windows\Registration Wizard Control",NoRegistration,,,,0,1,=,Medium
18.8.22.1.8,"Administrative Templates: System","Internet Communication Management: Internet Communication settings: Turn off Search Companion content file updates",Registry,,HKLM:\SOFTWARE\Policies\Microsoft\SearchCompanion,DisableContentFileUpdates,,,,0,1,=,Medium
18.8.22.1.9,"Administrative Templates: System","Internet Communication Management: Internet Communication settings: Turn off the 'Order Prints' picture task",Registry,,HKLM:\SOFTWARE\Microsoft\Windows\CurrentVersion\Policies\Explorer,NoOnlinePrintsWizard,,,,0,1,=,Medium
18.8.22.1.10,"Administrative Templates: System","Internet Communication Management: Internet Communication settings: Turn off the 'Publish to Web' task for files and folders",Registry,,HKLM:\SOFTWARE\Microsoft\Windows\CurrentVersion\Policies\Explorer,NoPublishingWizard,,,,0,1,=,Medium
