Id,CategoryEN,NameEN,Language,Category,Name
1621,".NET Framework: TLS Settings","Use Strong Crypto  (v2.0.50727)",,,
1619,".NET Framework: TLS Settings","Use Strong Crypto  (v2.0.50727, 32bit)",,,
1617,".NET Framework: TLS Settings","Use Strong Crypto  (v4.0.30319)",,,
1615,".NET Framework: TLS Settings","Use Strong Crypto  (v4.0.30319, 32bit)",,,
1620,".NET Framework: TLS Settings","Use System Default TLS Versions (v2.0.50727)",,,
1618,".NET Framework: TLS Settings","Use System Default TLS Versions (v2.0.50727, 32bit)",,,
1616,".NET Framework: TLS Settings","Use System Default TLS Versions (v4.0.30319)",,,
1614,".NET Framework: TLS Settings","Use System Default TLS Versions (v4.0.30319, 32bit)",,,
2,"Account Policies","Account lockout duration",DE,Kontorichtlinien,Kontosperrungsdauer
3,"Account Policies","Account lockout threshold",DE,Kontorichtlinien,Kontosperrungsschwelle
1695,"Account Policies","Allow Administrator account lockout",,,
338,"Account Policies","Length of password history maintained",DE,Kontorichtlinien,"Kennwortchronik erzwingen"
339,"Account Policies","Maximum password age",DE,Kontorichtlinien,"Maximales Kennwortalter"
340,"Account Policies","Minimum password age",DE,Kontorichtlinien,"Minimales Kennwortalter"
341,"Account Policies","Minimum password length",DE,Kontorichtlinien,"Minimale Kennwortlänge"
342,"Account Policies","Password must meet complexity requirements",DE,Kontorichtlinien,"Kennwort muss Komplexitätsvoraussetzungen entsprechen"
343,"Account Policies","Relax minimum password length limits",,,
4,"Account Policies","Reset account lockout counter",DE,Kontorichtlinien,"Zurücksetzungsdauer des Kontosperrungszählers"
344,"Account Policies","Store passwords using reversible encryption",DE,Kontorichtlinien,"Kennwort mit umkehrbarer Verschlüsselung speichern"
1667,"Administrative Templates","Printers: Allow Print Spooler to accept client connections",,,
1668,"Administrative Templates","Printers: Point and Print Restrictions: When installing drivers for a new connection",,,
1669,"Administrative Templates","Printers: Point and Print Restrictions: When updating drivers for an existing connection",,,
530,"Administrative Templates: Control Panel","Allow Online Tips",DE,"Administrative Vorlagen: Systemsteuerung","Onlinetipps zulassen"
735,"Administrative Templates: Control Panel","Enable screen saver",DE,"Administrative Vorlagen: Systemsteuerung","Bildschirmschoner aktivieren"
801,"Administrative Templates: Control Panel","Force specific screen saver: Screen saver executable name",DE,"Administrative Vorlagen: Systemsteuerung","Bestimmten Bildschirmschoner erzwingen"
736,"Administrative Templates: Control Panel","Password protect the screen saver",DE,"Administrative Vorlagen: Systemsteuerung","Kennwortschutz für den Bildschirmschoner verwenden"
98,"Administrative Templates: Control Panel","Personalization: Prevent enabling lock screen camera",DE,"Administrative Vorlagen: Systemsteuerung","Anpassung: Aktivieren der Sperrbildschirmkamera verhindern"
528,"Administrative Templates: Control Panel","Personalization: Prevent enabling lock screen slide show",DE,"Administrative Vorlagen: Systemsteuerung","Anpassung: Aktivieren der Diashow auf dem Sperrbildschirm verhindern"
529,"Administrative Templates: Control Panel","Regional and Language Options: Allow users to enable online speech recognition services",DE,"Administrative Vorlagen: Systemsteuerung","Regions- und Sprachoptionen: Aktivierung von Online-Spracherkennungsdiensten durch den Benutzer zulassen"
1551,"Administrative Templates: Control Panel","Regional and Language Options: Handwriting personalization: Turn off automatic learning (RestrictImplicitInkCollection)",DE,"Administrative Vorlagen: Systemsteuerung","Regions- und Sprachanpassung: Handschriftanpassung: Automatisches Lernen deaktivieren (RestrictImplicitInkCollection)"
1552,"Administrative Templates: Control Panel","Regional and Language Options: Handwriting personalization: Turn off automatic learning (RestrictImplicitTextCollection)",DE,"Administrative Vorlagen: Systemsteuerung","Regions- und Sprachanpassung: Handschriftanpassung: Automatisches Lernen deaktivieren (RestrictImplicitTextCollection)"
737,"Administrative Templates: Control Panel","Screen saver timeout",DE,"Administrative Vorlagen: Systemsteuerung","Zeitlimit für Bildschirmschoner"
532,"Administrative Templates: LAPS","Do not allow password expiration time longer than required by policy",,,
785,"Administrative Templates: LAPS","Do not allow password expiration time longer than required by policy (Member)",,,
533,"Administrative Templates: LAPS","Enable local admin password management",,,
786,"Administrative Templates: LAPS","Enable local admin password management (Member)",,,
531,"Administrative Templates: LAPS","LAPS AdmPwd GPO Extension / CSE",,,
784,"Administrative Templates: LAPS","LAPS AdmPwd GPO Extension / CSE (Member)",,,
536,"Administrative Templates: LAPS","Password Settings: Password Age (Days)",,,
789,"Administrative Templates: LAPS","Password Settings: Password Age (Days) (Member)",,,
534,"Administrative Templates: LAPS","Password Settings: Password Complexity",,,
787,"Administrative Templates: LAPS","Password Settings: Password Complexity (Member)",,,
535,"Administrative Templates: LAPS","Password Settings: Password Length",,,
788,"Administrative Templates: LAPS","Password Settings: Password Length (Member)",,,
1666,"Administrative Templates: Network","DNS Client: Configure DNS over HTTPS (DoH) name resolution",,,
1697,"Administrative Templates: Network","DNS Client: Configure NetBIOS settings",,,
99,"Administrative Templates: Network","DNS Client: Turn off multicast name resolution (LLMNR)",DE,"Administrative Vorlagen: Netzwerk","DNS-Client: Multicastnamensauflösung deaktivieren (LLMNR)"
568,"Administrative Templates: Network","Disable IPv6",,,
553,"Administrative Templates: Network","Fonts: Enable Font Providers",DE,"Administrative Vorlagen: Netzwerk","Schriftarten: Schriftartenanbieter aktivieren"
100,"Administrative Templates: Network","Lanman Workstation: Enable insecure guest logons",DE,"Administrative Vorlagen: Netzwerk","LanMan-Arbeitsstation: Unsichere Gastanmeldungen aktivieren"
556,"Administrative Templates: Network","Link-Layer Topology Discovery: Turn on Mapper I/O (LLTDIO) driver (AllowLLTDIOOnPublicNet)",DE,"Administrative Vorlagen: Netzwerk","Verbindungsschicht-Topologieerkennung: Treiber für die Zuordnungs-E/A (LLTDIO) aktivieren (AllowLLTDIOOnPublicNet)"
555,"Administrative Templates: Network","Link-Layer Topology Discovery: Turn on Mapper I/O (LLTDIO) driver (AllowLLTDIOOndomain)",DE,"Administrative Vorlagen: Netzwerk","Verbindungsschicht-Topologieerkennung: Treiber für die Zuordnungs-E/A (LLTDIO) aktivieren (AllowLLTDIOOndomain)"
557,"Administrative Templates: Network","Link-Layer Topology Discovery: Turn on Mapper I/O (LLTDIO) driver (EnableLLTDIO)",DE,"Administrative Vorlagen: Netzwerk","Verbindungsschicht-Topologieerkennung: Treiber für die Zuordnungs-E/A (LLTDIO) aktivieren (EnableLLTDIO)"
558,"Administrative Templates: Network","Link-Layer Topology Discovery: Turn on Mapper I/O (LLTDIO) driver (ProhibitLLTDIOOnPrivateNet)",DE,"Administrative Vorlagen: Netzwerk","Verbindungsschicht-Topologieerkennung: Treiber für die Zuordnungs-E/A (LLTDIO) aktivieren (ProhibitLLTDIOOnPrivateNet)"
563,"Administrative Templates: Network","Network Connections: Prohibit installation and configuration of Network Bridge on your DNS domain network",DE,"Administrative Vorlagen: Netzwerk","Netzwerkverbindungen: Installation und Konfiguration der Netzwerkbridge im eigenen DNS-Domänennetzwerk nicht zulassen"
564,"Administrative Templates: Network","Network Connections: Prohibit use of Internet Connection Sharing on your DNS domain network",DE,"Administrative Vorlagen: Netzwerk","Netzwerkverbindungen: Verwendung der gemeinsam genutzten Internetverbindung im eigenen DNS-Domänennetzwerk nicht zulassen"
565,"Administrative Templates: Network","Network Connections: Require domain users to elevate when setting a network's location",DE,"Administrative Vorlagen: Netzwerk","Netzwerkverbindungen: Höhere Rechte von Domänenbenutzern beim Festlegen einer Netzwerkadresse anfordern"
566,"Administrative Templates: Network","Network Provider: Hardened UNC Paths (NETLOGON)",DE,"Administrative Vorlagen: Netzwerk","Netzwerkanbieter: Gehärtete UNC-Pfade (NETLOGON)"
567,"Administrative Templates: Network","Network Provider: Hardened UNC Paths (SYSVOL)",DE,"Administrative Vorlagen: Netzwerk","Netzwerkanbieter: Gehärtete UNC-Pfade (SYSVOL)"
1328,"Administrative Templates: Network","SSL Configuration Settings: ECC Curve Order",,,
1602,"Administrative Templates: Network","SSL Configuration Settings: SSL Cipher Suite Order",,,
101,"Administrative Templates: Network","Turn off Microsoft Peer-to-Peer Networking Services",DE,"Administrative Vorlagen: Netzwerk","Microsoft Peer-zu-Peer-Netzwerkdienste deaktivieren"
559,"Administrative Templates: Network","Turn on Responder (RSPNDR) driver (AllowRspndrOnDomain)",DE,"Administrative Vorlagen: Netzwerk","Treiber für den Beantworter (RSPNDR) aktivieren (AllowRspndrOnDomain)"
560,"Administrative Templates: Network","Turn on Responder (RSPNDR) driver (AllowRspndrOnPublicNet)",DE,"Administrative Vorlagen: Netzwerk","Treiber für den Beantworter (RSPNDR) aktivieren (AllowRspndrOnPublicNet)"
561,"Administrative Templates: Network","Turn on Responder (RSPNDR) driver (EnableRspndr)",DE,"Administrative Vorlagen: Netzwerk","Treiber für den Beantworter (RSPNDR) aktivieren (EnableRspndr)"
562,"Administrative Templates: Network","Turn on Responder (RSPNDR) driver (ProhibitRspndrOnPrivateNet)",DE,"Administrative Vorlagen: Netzwerk","Treiber für den Beantworter (RSPNDR) aktivieren (ProhibitRspndrOnPrivateNet)"
102,"Administrative Templates: Network","WLAN Settings: Allow Windows to automatically connect to suggested open hotspots, to networks shared by contacts, and to hotspots offering paid services",DE,"Administrative Vorlagen: Netzwerk","WLAN-Einstellungen: Zulassen, dass Windows automatisch eine Verbindung mit vorgeschlagenen öffentlichen Hotspots, von Kontakten freigegebenen Netzwerken und kostenpflichtigen Hotspots herstellt"
572,"Administrative Templates: Network","Windows Connect Now: Configuration of wireless settings using Windows Connect Now (DisableFlashConfigRegistrar)",DE,"Administrative Vorlagen: Netzwerk","Windows-Sofortverbindung: Konfiguration von Drahtloseinstellungen mit Windows-Sofortverbindung (DisableFlashConfigRegistrar)"
571,"Administrative Templates: Network","Windows Connect Now: Configuration of wireless settings using Windows Connect Now (DisableInBand802DOT11Registrar)",DE,"Administrative Vorlagen: Netzwerk","Windows-Sofortverbindung: Konfiguration von Drahtloseinstellungen mit Windows-Sofortverbindung (DisableInBand802DOT11Registrar)"
570,"Administrative Templates: Network","Windows Connect Now: Configuration of wireless settings using Windows Connect Now (DisableUPnPRegistrar)",DE,"Administrative Vorlagen: Netzwerk","Windows-Sofortverbindung: Konfiguration von Drahtloseinstellungen mit Windows-Sofortverbindung (DisableUPnPRegistrar)"
573,"Administrative Templates: Network","Windows Connect Now: Configuration of wireless settings using Windows Connect Now (DisableWPDRegistrar)",DE,"Administrative Vorlagen: Netzwerk","Windows-Sofortverbindung: Konfiguration von Drahtloseinstellungen mit Windows-Sofortverbindung (DisableWPDRegistrar)"
569,"Administrative Templates: Network","Windows Connect Now: Configuration of wireless settings using Windows Connect Now (EnableRegistrars)",DE,"Administrative Vorlagen: Netzwerk","Windows-Sofortverbindung: Konfiguration von Drahtloseinstellungen mit Windows-Sofortverbindung (EnableRegistrars)"
574,"Administrative Templates: Network","Windows Connect Now: Prohibit access of the Windows Connect Now wizards",DE,"Administrative Vorlagen: Netzwerk","Windows-Sofortverbindung: Zugriff auf Windows-Sofortverbindungs-Assistenten verweigern"
575,"Administrative Templates: Network","Windows Connection Manager: Minimize the number of simultaneous connections to the Internet or a Windows Domain",DE,"Administrative Vorlagen: Netzwerk","Windows-Verbindungs-Manager: Anzahl gleichzeitiger Verbindungen mit dem Internet oder einer Windows-Domäne minimieren"
576,"Administrative Templates: Network","Windows Connection Manager: Prohibit connection to non-domain networks when connected to domain authenticated network",DE,"Administrative Vorlagen: Netzwerk","Windows-Verbindungs-Manager: Verbindung mit Nicht-Domänennetzwerken bei vorhandener Verbindung mit domänenauthentifiziertem Netzwerk nicht zulassen"
1751,"Administrative Templates: PowerShellCore","Turn on PowerShell Module Logging",,,
1759,"Administrative Templates: PowerShellCore","Turn on PowerShell Module Logging",,,
1764,"Administrative Templates: PowerShellCore","Turn on PowerShell Module Logging (PowerShell Policy)",,,
1765,"Administrative Templates: PowerShellCore","Turn on PowerShell Module Logging (PowerShell Policy)",,,
1752,"Administrative Templates: PowerShellCore","Turn on PowerShell Module Logging - Module Names",,,
1760,"Administrative Templates: PowerShellCore","Turn on PowerShell Module Logging - Module Names",,,
1748,"Administrative Templates: PowerShellCore","Turn on PowerShell Script Block Logging",,,
1756,"Administrative Templates: PowerShellCore","Turn on PowerShell Script Block Logging",,,
1749,"Administrative Templates: PowerShellCore","Turn on PowerShell Script Block Logging (Invocation)",,,
1757,"Administrative Templates: PowerShellCore","Turn on PowerShell Script Block Logging (Invocation)",,,
1750,"Administrative Templates: PowerShellCore","Turn on PowerShell Script Block Logging (PowerShell Policy)",,,
1758,"Administrative Templates: PowerShellCore","Turn on PowerShell Script Block Logging (PowerShell Policy)",,,
1753,"Administrative Templates: PowerShellCore","Turn on PowerShell Transcription",,,
1761,"Administrative Templates: PowerShellCore","Turn on PowerShell Transcription",,,
1754,"Administrative Templates: PowerShellCore","Turn on PowerShell Transcription (Invocation)",,,
1762,"Administrative Templates: PowerShellCore","Turn on PowerShell Transcription (Invocation)",,,
1755,"Administrative Templates: PowerShellCore","Turn on PowerShell Transcription (PowerShell Policy)",,,
1763,"Administrative Templates: PowerShellCore","Turn on PowerShell Transcription (PowerShell Policy)",,,
1700,"Administrative Templates: Printers","Configure RPC connection settings (RpcAuthentication)",,,
1699,"Administrative Templates: Printers","Configure RPC connection settings (RpcUseNamedPipeProtocol)",,,
1702,"Administrative Templates: Printers","Configure RPC listener settings (ForceKerberosForRpc)",,,
1701,"Administrative Templates: Printers","Configure RPC listener settings (RpcProtocols)",,,
1703,"Administrative Templates: Printers","Configure RPC over TCP port",,,
1698,"Administrative Templates: Printers","Configure Redirection Guard",,,
1704,"Administrative Templates: Printers","Limits print driver installation to Administrators",,,
1705,"Administrative Templates: Printers","Manage processing of Queue-specific files",,,
1650,"Administrative Templates: Printers","Only use Package Point and Print (CVE-2021-36958)",,,
1651,"Administrative Templates: Printers","Package Point and Print - Approved servers (CVE-2021-36958)",,,
1645,"Administrative Templates: Printers","Point and Print Restrictions: Only administrators can install printer drivers on a print server (CVE-2021-34527)",,,
1643,"Administrative Templates: Printers","Point and Print Restrictions: When installing drivers for a new connection (CVE-2021-34527)",,,
1644,"Administrative Templates: Printers","Point and Print Restrictions: When updating drivers for an existing connection (CVE-2021-34527)",,,
298,"Administrative Templates: Start Menu and Taskbar","Notifications: Turn off notifications network usage",,,
577,"Administrative Templates: Start Menu and Taskbar","Notifications: Turn off notifications network usage",DE,"Administrative Vorlagen: Startmenü und Taskleiste","Benachrichtigungen: Netzwerkverwendung für Benachrichtigungen deaktivieren"
299,"Administrative Templates: Start Menu and Taskbar","Notifications: Turn off toast notifications on the lock screen",DE,"Administrative Vorlagen: Startmenü und Taskleiste","Benachrichtigungen: Popupbenachrichtigungen auf gesperrtem Bildschirm deaktivieren"
578,"Administrative Templates: System","Audit Process Creation: Include command line in process creation events",,,
103,"Administrative Templates: System","Credentials Delegation: Allow delegation default credentials",,,
104,"Administrative Templates: System","Credentials Delegation: Encryption Oracle Remediation",DE,"Administrative Vorlagen: System","Delegierung von Anmeldeinformationen: Encryption Oracle-Abwehr"
819,"Administrative Templates: System","Credentials Delegation: Remote host allows delegation of non-exportable credentials",DE,"Administrative Vorlagen: System","Delegierung von Anmeldeinformationen: Remotehost ermöglicht die Delegierung nicht exportierbarer Anmeldeinformationen"
114,"Administrative Templates: System","Device Guard: Available Security Properties: DMA protection",,,
113,"Administrative Templates: System","Device Guard: Available Security Properties: Secure Boot",,,
793,"Administrative Templates: System","Device Guard: Credential Guard Configuration (DC)",,,
792,"Administrative Templates: System","Device Guard: Credential Guard Configuration (Member)",,,
582,"Administrative Templates: System","Device Guard: Credential Guard Configuration (Policy)",,,
1706,"Administrative Templates: System","Device Guard: Kernel-mode Hardware-enforced Stack Protection (Policy)",,,
119,"Administrative Templates: System","Device Guard: Require UEFI Memory Attributes Table (Policy)",,,
120,"Administrative Templates: System","Device Guard: Secure Launch Configuration (Policy)",,,
115,"Administrative Templates: System","Device Guard: Security Services Configured: Credential Guard",,,
116,"Administrative Templates: System","Device Guard: Security Services Configured: HVCI",,,
117,"Administrative Templates: System","Device Guard: Security Services Running: Credential Guard",,,
118,"Administrative Templates: System","Device Guard: Security Services Running: HVCI",,,
580,"Administrative Templates: System","Device Guard: Select Platform Security Level (Policy)",,,
1307,"Administrative Templates: System","Device Guard: Support for Virtualization Based Security (Microsoft-Hyper-V-Hypervisor)",,,
579,"Administrative Templates: System","Device Guard: Turn On Virtualization Based Security (Policy)",,,
581,"Administrative Templates: System","Device Guard: Virtualization Based Protection of Code Integrity (Policy)",,,
112,"Administrative Templates: System","Device Guard: Virtualization Based Security Status",,,
121,"Administrative Templates: System","Device Guard: Windows Defender Application Control deployed (Policy)",,,
1684,"Administrative Templates: System","Device Installation: Device Installation Restrictions: Prevent device metadata retrieval from the Internet",,,
107,"Administrative Templates: System","Device Installation: Device Installation Restrictions: Prevent installation of devices that match ID PCI\CC_0C0010 (Firewire)",,,
108,"Administrative Templates: System","Device Installation: Device Installation Restrictions: Prevent installation of devices that match ID PCI\CC_0C0A (Thunderbolt)",DE,"Administrative Vorlagen: System","Geräteinstallation: Einschränkungen bei der Geräteinstallation: Installation von Geräten mit diesen Geräte-IDs verhindern PCI\CC_0C0A (Thunderbolt)"
105,"Administrative Templates: System","Device Installation: Device Installation Restrictions: Prevent installation of devices that match an ID",DE,"Administrative Vorlagen: System","Geräteinstallation: Einschränkungen bei der Geräteinstallation: Installation von Geräten mit diesen Geräte-IDs verhindern"
106,"Administrative Templates: System","Device Installation: Device Installation Restrictions: Prevent installation of devices that match an ID (Retroactive)",DE,"Administrative Vorlagen: System","Geräteinstallation: Einschränkungen bei der Geräteinstallation: Installation von Geräten mit diesen Geräte-IDs verhindern (Retroactive)"
586,"Administrative Templates: System","Device Installation: Device Installation Restrictions: Prevent installation of devices using drivers that match 6bdd1fc1-810f-11d0-bec7-08002be2092f (SBP-2 drive)",DE,"Administrative Vorlagen: System","Geräteinstallation: Einschränkungen bei der Geräteinstallation: Installation von Geräten mit Treibern verhindern, die diesen Gerätesetupklassen entsprechen 6bdd1fc1-810f-11d0-bec7-08002be2092f (SBP-2 drive)"
584,"Administrative Templates: System","Device Installation: Device Installation Restrictions: Prevent installation of devices using drivers that match 7ebefbc0-3200-11d2-b4c2-00a0C9697d07 (SBP-2 drive)",DE,"Administrative Vorlagen: System","Geräteinstallation: Einschränkungen bei der Geräteinstallation: Installation von Geräten mit Treibern verhindern, die diesen Gerätesetupklassen entsprechen 7ebefbc0-3200-11d2-b4c2-00a0C9697d07 (SBP-2 drive)"
109,"Administrative Templates: System","Device Installation: Device Installation Restrictions: Prevent installation of devices using drivers that match an device setup class",DE,"Administrative Vorlagen: System","Geräteinstallation: Einschränkungen bei der Geräteinstallation: Installation von Geräten mit Treibern verhindern, die diesen Gerätesetupklassen entsprechen"
110,"Administrative Templates: System","Device Installation: Device Installation Restrictions: Prevent installation of devices using drivers that match an device setup class (Retroactive)",DE,"Administrative Vorlagen: System","Geräteinstallation: Einschränkungen bei der Geräteinstallation: Installation von Geräten mit Treibern verhindern, die diesen Gerätesetupklassen entsprechen (Retroactive)"
585,"Administrative Templates: System","Device Installation: Device Installation Restrictions: Prevent installation of devices using drivers that match c06ff265-ae09-48f0-812c-16753d7cba83 (SBP-2 drive)",DE,"Administrative Vorlagen: System","Geräteinstallation: Einschränkungen bei der Geräteinstallation: Installation von Geräten mit Treibern verhindern, die diesen Gerätesetupklassen entsprechen c06ff265-ae09-48f0-812c-16753d7cba83 (SBP-2 drive)"
111,"Administrative Templates: System","Device Installation: Device Installation Restrictions: Prevent installation of devices using drivers that match d48179be-ec20-11d1-b6b8-00c04fa372a7 (SBP-2 drive)",DE,"Administrative Vorlagen: System","Geräteinstallation: Einschränkungen bei der Geräteinstallation: Installation von Geräten mit Treibern verhindern, die diesen Gerätesetupklassen entsprechen d48179be-ec20-11d1-b6b8-00c04fa372a7 (SBP-2 drive)"
122,"Administrative Templates: System","Early Launch Antimalware: Boot-Start Driver Initialization Policy",DE,"Administrative Vorlagen: System","Antischadsoftware-Frühstart: Richtlinie für Bootstarttreiber-Initialisierung"
1688,"Administrative Templates: System","Group Policy: Configure security policy processing: Process even if the Group Policy objects have not changed",,,
587,"Administrative Templates: System","Group Policy: Continue experiences on this device",DE,"Administrative Vorlagen: System","Gruppenrichtlinie: Auf der Oberfläche dieses Geräts weiterverarbeiten"
124,"Administrative Templates: System","Group Policy: Do not apply during periodic background processing",DE,"Administrative Vorlagen: System","Gruppenrichtlinie: Während regelmäßiger Hintergrundverarbeitung nicht übernehmen"
123,"Administrative Templates: System","Group Policy: Process even if the Group Policy objects have not changed",DE,"Administrative Vorlagen: System","Gruppenrichtlinie: Gruppenrichtlinienobjekte auch ohne Änderungen verarbeiten"
588,"Administrative Templates: System","Group Policy: Turn off background refresh of Group Policy",DE,"Administrative Vorlagen: System","Gruppenrichtlinie: Hintergrundaktualisierung der Gruppenrichtlinie deaktivieren"
300,"Administrative Templates: System","Internet Communication Management: Internet Communication Settings: Turn off Help Experience Improvement Program",DE,"Administrative Vorlagen: System","Internetkommunikationsverwaltung: Internetkommunikationseinstellungen: Programm zur Verbesserung der Hilfebenutzerfreundlichkeit deaktivieren"
592,"Administrative Templates: System","Internet Communication Management: Internet Communication settings: Turn off Internet Connection Wizard if URL connection is referring to Microsoft.com",DE,"Administrative Vorlagen: System","Internetkommunikationsverwaltung: Internetkommunikationseinstellungen: Verbindungs-Assistenten deaktivieren, wenn sich die URL-Verbindung auf microsoft.com bezieht"
129,"Administrative Templates: System","Internet Communication Management: Internet Communication settings: Turn off Internet download for Web publishing and online ordering wizards",DE,"Administrative Vorlagen: System","Internetkommunikationsverwaltung: Internetkommunikationseinstellungen: Internet-Download für die Assistenten ""Webpublishing"" und ""Onlinebestellung von Abzügen"" deaktivieren"
594,"Administrative Templates: System","Internet Communication Management: Internet Communication settings: Turn off Registration if URL connection is referring to Microsoft.com",DE,"Administrative Vorlagen: System","Internetkommunikationsverwaltung: Internetkommunikationseinstellungen: Registrierung deaktivieren, wenn sich die URL-Verbindung auf ""Microsoft.com"" bezieht"
